{
  "kind": "workflow.v1",
  "schema_version": "1",
  "workflow_id": "claude-gstack-qa",
  "authority": "human://operator",
  "entry_node": "inspect",
  "terminal_nodes": ["finish"],
  "nodes": [
    {
      "id": "inspect",
      "executor": { "actor": "agent://claude-code" },
      "allowed_tools": ["Read", "Grep"]
    },
    {
      "id": "change",
      "executor": { "actor": "agent://claude-code" },
      "allowed_tools": ["Edit", "Write"]
    },
    {
      "id": "qa",
      "executor": { "capability": "qa.browser" },
      "allowed_tools": ["gstack.qa"]
    },
    {
      "id": "finish",
      "executor": { "actor": "agent://claude-code" },
      "allowed_tools": []
    }
  ],
  "edges": [
    { "from": "inspect", "to": "change", "when": "always" },
    { "from": "change", "to": "qa", "when": "always" },
    { "from": "qa", "to": "finish", "when": "on_pass" },
    { "from": "qa", "to": "change", "when": "on_fail" }
  ],
  "loops": [
    {
      "id": "repair",
      "back_edge": { "from": "qa", "to": "change" },
      "max_iterations": 2,
      "budget": { "max_actions": 30 }
    }
  ]
}
